{
  "job_id": "a1b2c3d4-0000-4000-8000-000000000001",
  "owner_id": "M-7f3a",
  "akte_hint": null,
  "source": "foto",
  "document": {
    "storage_url": "https://blob.lichtreich.info/uploads/M-7f3a/a1b2c3d4.jpg",
    "mime": "image/jpeg"
  },
  "hints": ["Fristsache? Bitte Widerspruchsfrist prüfen", "gehört evtl. zu O2"],
  "callback": {
    "status_url": "https://briefkasten.lichtreich.info/api/jobs/a1b2c3d4-0000-4000-8000-000000000001",
    "webhook": null
  },
  "meta": { "app": "briefkasten", "ts": "2026-07-16T02:10:00Z" }
}
